{"$defs":{"adr_id":{"pattern":"^ADR-[0-9]{4}$","type":"string"},"atomic_mapping":{"properties":{"affected_profile_ids":{"minItems":1},"affected_rule_ids":{"minItems":1},"alternatives":{"minItems":1},"consequences":{"minItems":1},"migration":{"minItems":1},"migration_ids":{},"reference_artifact_ids":{"minItems":1},"verification_impact":{"minItems":1}}},"canonical_relative_path":{"format":"ifl-canonical-relative-path-v1","minLength":1,"pattern":"^(?!\\s)(?!.*\\s$)(?!/)(?!.*(?:^|/)\\.{1,2}(?:/|$))(?!.*//)(?!.*\\\\)(?!.*[*?\\[\\]{}])[^\\u0000-\\u001F\\u007F-\\u009F\\u2028\\u2029]+$","type":"string","x-ifl-format-assertion-required":true},"check_id":{"pattern":"^CHK-[A-Z0-9]+(?:-[A-Z0-9]+)*$","type":"string"},"fixture_id":{"pattern":"^FIX-[A-Z0-9]+(?:-[A-Z0-9]+)*$","type":"string"},"migration_id":{"pattern":"^MIG-[A-Z0-9]+(?:-[A-Z0-9]+)*$","type":"string"},"non_blank":{"minLength":1,"pattern":"^(?!\\s)(?!.*\\s$)[^\\u0000-\\u001F\\u007F-\\u009F]+$","type":"string"},"non_blank_array":{"items":{"$ref":"#/$defs/non_blank"},"type":"array","uniqueItems":true},"profile_id":{"pattern":"^[a-z][a-z0-9]*(?:-[a-z][a-z0-9]*)*$","type":"string"},"rule_id":{"pattern":"^(?:[A-Z0-9]+-){2,}[0-9]{3}$","type":"string"},"sha256":{"pattern":"^[0-9a-f]{64}$","type":"string"}},"$id":"urn:ifl:standards:schema:adr-metadata:v1","$schema":"https://json-schema.org/draft/2020-12/schema","additionalProperties":false,"allOf":[{"if":{"properties":{"status":{"const":"accepted"}},"required":["status"]},"then":{"allOf":[{"required":["accepted_at"]},{"not":{"required":["superseded_by"]}},{"$ref":"#/$defs/atomic_mapping"}]}},{"if":{"properties":{"status":{"const":"superseded"}},"required":["status"]},"then":{"allOf":[{"required":["accepted_at","superseded_by"]},{"$ref":"#/$defs/atomic_mapping"}]}},{"if":{"properties":{"status":{"enum":["draft","in_review","rejected"]}},"required":["status"]},"then":{"not":{"anyOf":[{"required":["accepted_at"]},{"required":["superseded_by"]}]}}}],"properties":{"accepted_at":{"format":"ifl-canonical-timestamp-v1","pattern":"^(?!0000-)(?!.*[\\u0000-\\u001F\\u007F-\\u009F\\u2028\\u2029])[0-9]{4}-(?:0[1-9]|1[0-2])-(?:0[1-9]|[12][0-9]|3[01])T(?:[01][0-9]|2[0-3]):[0-5][0-9]:[0-5][0-9]\\.[0-9]{3}Z$","type":"string","x-ifl-format-assertion-required":true},"affected_profile_ids":{"items":{"$ref":"#/$defs/profile_id"},"type":"array","uniqueItems":true},"affected_rule_ids":{"items":{"$ref":"#/$defs/rule_id"},"type":"array","uniqueItems":true},"alternatives":{"$ref":"#/$defs/non_blank_array"},"check_ids":{"items":{"$ref":"#/$defs/check_id"},"type":"array","uniqueItems":true},"consequences":{"$ref":"#/$defs/non_blank_array"},"context":{"$ref":"#/$defs/non_blank"},"decision":{"$ref":"#/$defs/non_blank"},"decision_date":{"format":"ifl-canonical-date-v1","pattern":"^(?!0000-)(?!.*[\\u0000-\\u001F\\u007F-\\u009F\\u2028\\u2029])[0-9]{4}-(?:0[1-9]|1[0-2])-(?:0[1-9]|[12][0-9]|3[01])$","type":"string","x-ifl-format-assertion-required":true},"fixture_ids":{"items":{"$ref":"#/$defs/fixture_id"},"type":"array","uniqueItems":true},"id":{"$ref":"#/$defs/adr_id"},"markdown_digest":{"$ref":"#/$defs/sha256"},"migration":{"$ref":"#/$defs/non_blank_array"},"migration_ids":{"items":{"$ref":"#/$defs/migration_id"},"type":"array","uniqueItems":true},"owner_role_id":{"$ref":"#/$defs/non_blank"},"reference_artifact_ids":{"items":{"$ref":"#/$defs/canonical_relative_path"},"type":"array","uniqueItems":true},"schema_version":{"const":1},"status":{"enum":["draft","in_review","accepted","superseded","rejected"],"type":"string"},"superseded_by":{"$ref":"#/$defs/adr_id"},"supersedes_adr_ids":{"items":{"$ref":"#/$defs/adr_id"},"type":"array","uniqueItems":true},"title":{"$ref":"#/$defs/non_blank"},"verification_impact":{"$ref":"#/$defs/non_blank_array"}},"required":["schema_version","id","title","status","owner_role_id","decision_date","markdown_digest","context","decision","alternatives","consequences","migration","affected_rule_ids","affected_profile_ids","verification_impact","check_ids","fixture_ids","reference_artifact_ids","migration_ids","supersedes_adr_ids"],"title":"IFL Canon ADR Metadata v1","type":"object"}
