{"accepted_at":"2026-07-12T23:23:34.000Z","affected_profile_ids":["core","swiftui"],"affected_rule_ids":["CONC-ISO-001","CONC-SEND-001","CONC-TASK-001","CONC-CANCEL-001","CONC-CONT-001","CONC-LEGACY-001","SWUI-STATE-001","SWUI-LIFE-001"],"alternatives":["Keep callback queues and informal thread documentation as the concurrency model.","Put all asynchronous code on MainActor.","Use unstructured or detached tasks by default.","Apply @unchecked Sendable broadly during migration."],"check_ids":[],"consequences":["Actor ownership and data crossings become explicit and reviewable.","Some boundary models must become immutable Sendable snapshots.","Task lifetime and cancellation become part of feature design instead of cleanup after defects.","Legacy adapters require deliberate terminal-state and cancellation handling.","UIKit and SwiftUI presentation mutation share one MainActor contract."],"context":"Swift 6 makes previously implicit concurrency assumptions visible. A five-year iOS standard needs one model for isolation, Sendable crossings, task lifetime, cancellation, UI mutation, continuations, and legacy callbacks without prescribing one business architecture or hiding risk behind unchecked escape hatches.","decision":"Adopt Swift 6 complete strict concurrency, assign every mutable state boundary an explicit actor or synchronization owner, require Sendable values across isolation boundaries, prefer structured task ownership, propagate cancellation, isolate UI presentation on MainActor, and adapt one-shot legacy callbacks through exactly-once checked continuations.","decision_date":"2026-07-13","fixture_ids":[],"id":"ADR-0010","markdown_digest":"ceb754a9fe18336711c3462dc1565b552ceadc34174e4a71277d4d19b71a10ed","migration":["Enable Swift 6 complete strict-concurrency diagnostics incrementally by target.","Assign ownership to mutable shared state and isolate UI-facing mutation on MainActor.","Replace cross-boundary reference sharing with Sendable values or actor methods.","Convert fire-and-forget work to structured or explicitly owned tasks and add cancellation cleanup.","Wrap remaining callback/delegate boundaries in checked adapters, documenting temporary unchecked conformances with owners and removal dates."],"migration_ids":[],"owner_role_id":"Concurrency Chapter Owner","reference_artifact_ids":["standards/enterprise/swift-6-concurrency.md","standards/enterprise/swiftui-production.md"],"schema_version":1,"status":"accepted","supersedes_adr_ids":[],"title":"Concurrency and Isolation","verification_impact":["The single final joined AI consistency review checks isolation, Sendable crossings, task ownership, cancellation, exactly-once continuation semantics, legacy bridges, and MainActor presentation consistency across the complete Standards change."]}
