{"accepted_at":"2026-07-12T23:23:34.000Z","affected_profile_ids":["boardy-vip"],"affected_rule_ids":["BRD-COMM-001","BRD-CTX-001","BRD-NAV-001"],"alternatives":["Communicate through retrieved controller references","Infer return behavior from the current navigation stack"],"check_ids":[],"consequences":["Cross-board communication remains typed","Navigation policy stays outside rendering adapters","Return behavior is explicit across entry points"],"context":"Cross-board flows require typed communication and explicit navigation context without coupling Board lifecycle to controller references.","decision":"Use owner-defined typed IO, flows, and buses; forward navigation intent to the Board or coordinator and carry explicit return-context semantics.","decision_date":"2026-07-13","fixture_ids":[],"id":"ADR-0006","markdown_digest":"a66b8182257de94d662c00637a58acba5c2302b8e4defc19997e3f23aa9a8a92","migration":["Replace controller reach-through with typed IO or buses, move navigation policy out of Views, and make return context explicit."],"migration_ids":["MIG-ADR-0006"],"owner_role_id":"iOS Profile Owner","reference_artifact_ids":["standards/specs/PLUGINS_INTEGRATION.md"],"schema_version":1,"status":"accepted","supersedes_adr_ids":[],"title":"Board communication, navigation, and context","verification_impact":["The final joined AI consistency review confirms communication, navigation, and context obligations remain aligned across Canon and Boardy specs."]}
