{"accepted_at":"2026-07-10T00:00:00.000Z","affected_profile_ids":["core"],"affected_rule_ids":["CAN-MINIMAL-001"],"alternatives":["Keep the fixture indexes empty."],"check_ids":["CHK-CAN-MINIMAL-001"],"consequences":["The fixture remains small and exercises accepted ADR integrity."],"context":"The Canon loader needs one deterministic accepted ADR in its minimal fixture.","decision":"Bind the minimal rule and core profile through one complete atomic mapping.","decision_date":"2026-07-10","fixture_ids":["FIX-CAN-MINIMAL-001-FAIL-001"],"id":"ADR-9999","markdown_digest":"636a09cf6c52903ee772794f2080fd22b7c1804dfe1e979172601ff401ce9460","migration":["No migration is required for this test-only fixture."],"migration_ids":["MIG-CAN-MINIMAL-001"],"owner_role_id":"Canon Maintainer","reference_artifact_ids":["adrs/ADR-9999-minimal-test.md"],"schema_version":1,"status":"accepted","supersedes_adr_ids":[],"title":"Minimal Canon Fixture","verification_impact":["Decode the complete index-first root and validate every declared digest."]}
