{"accepted_at":"2026-07-12T23:23:34.000Z","affected_profile_ids":["boardy-vip","core"],"affected_rule_ids":["BRD-ACTIVATION-001","BRD-COMP-001","BRD-FLOW-001","BRD-MOD-001","BRD-REF-001","BRD-REPOSITORY-001","CORE-API-001","CORE-COMP-001"],"alternatives":["Resolve concrete dependencies from feature implementations","Construct shared repositories inside registration closures"],"check_ids":[],"consequences":["Application assembly remains possible without opening implementation APIs between features","Board registrations have stable dependency ownership","Re-activation does not multiply handlers or retain parent objects through back edges"],"context":"Boardy composition must construct concrete implementations at the application edge while preserving feature visibility and lifecycle ownership.","decision":"Restrict implementation imports and concrete construction to declared composition roots; keep required back edges weak, register flows in init, guard activation only when explicitly single-session, and store shared repositories on ModulePlugin.","decision_date":"2026-07-13","fixture_ids":[],"id":"ADR-0007","markdown_digest":"d738c66ea2bc8e57bf4f7d9bdd5b29996347361c6eb5edc5f109e9a0a43a61b1","migration":["Move construction to declared roots, narrow public visibility, weaken back edges, register flows in init, and move shared repositories to ModulePlugin ownership."],"migration_ids":["MIG-ADR-0007"],"owner_role_id":"iOS Profile Owner","reference_artifact_ids":["standards/specs/CROSS_MODULE_DI.md"],"schema_version":1,"status":"accepted","supersedes_adr_ids":[],"title":"Composition, DI, registration, and visibility","verification_impact":["The final joined AI consistency review confirms composition, visibility, reference, flow-registration, activation, and repository ownership guidance is consistent."]}
