{"accepted_at":"2026-07-12T23:23:34.000Z","affected_profile_ids":["swiftui"],"affected_rule_ids":["UI-COPY-001","UI-HUMBLE-001","UI-HUMBLE-002","UI-HUMBLE-003","UI-HUMBLE-004","UI-ISOLATION-001","SWUI-ID-001","SWUI-INTEROP-001","SWUI-LIFE-001","SWUI-NAV-001","SWUI-PERF-001","SWUI-STATE-001","SWUI-VIEW-001"],"alternatives":["Treat every SwiftUI local state value as product state","Allow SwiftUI Views to format domain values and own business decisions"],"check_ids":[],"consequences":["SwiftUI retains ergonomic local interaction state without owning product policy","UIKit and SwiftUI render equivalent semantic output","Presentation-store isolation and ownership are explicit"],"context":"SwiftUI local state and computed rendering must not blur the boundary between transient UX mechanics and display-ready product state.","decision":"Deliver display-ready product state through a MainActor presentation store and limit View-local state to transient UX and geometry-only rendering mechanics.","decision_date":"2026-07-13","fixture_ids":[],"id":"ADR-0009","markdown_digest":"10399cb81b1bf76d6d9bd30cbce0f8147cddc8b3b61956fb394a111e5c06bb73","migration":["Introduce a MainActor presentation store, move product computations and formatting to the presentation mapper, and keep only UX-local state in SwiftUI Views."],"migration_ids":["MIG-ADR-0009"],"owner_role_id":"SwiftUI Profile Owner","reference_artifact_ids":["standards/brain/patterns/VIP.md"],"schema_version":1,"status":"accepted","supersedes_adr_ids":[],"title":"SwiftUI rendering adapter","verification_impact":["The final joined AI consistency review confirms the SwiftUI store and humble-View guidance matches the shared presentation Rules and UIKit semantics."]}
