{"accepted_at":"2026-07-12T23:23:34.000Z","affected_profile_ids":["boardy-vip","core"],"affected_rule_ids":["BRD-MOD-001","CORE-API-001"],"alternatives":["Expose one public target per feature","Rely on convention to prevent implementation imports"],"check_ids":[],"consequences":["Cross-feature consumers depend on stable contracts","Composition roots retain narrowly scoped construction access","Implementation declarations remain internal by default"],"context":"Feature modules need a stable cross-feature surface without exposing construction and implementation details.","decision":"Separate public IO contract targets from implementation targets; cross-feature consumers import IO only, while declared composition roots may access explicitly registered composition entries.","decision_date":"2026-07-13","fixture_ids":[],"id":"ADR-0003","markdown_digest":"9a07ef089386109e2091d4fbc3c3c3e7067dc0da82b81323e95dd17dfea9b739","migration":["Split mixed targets, move shared contracts to IO, internalize implementation declarations, and expose only required composition entries."],"migration_ids":["MIG-ADR-0003"],"owner_role_id":"iOS Profile Owner","reference_artifact_ids":["standards/specs/ARCHITECTURE.md"],"schema_version":1,"status":"accepted","supersedes_adr_ids":[],"title":"Contract versus implementation targets","verification_impact":["The final joined AI consistency review confirms target boundaries, visibility, and reciprocal Rule/Profile/ADR references."]}
