{"accepted_at":"2026-07-12T23:23:34.000Z","affected_profile_ids":["core"],"affected_rule_ids":["CORE-DEP-001","CORE-DEP-002","CORE-DEP-003","DATA-BACKUP-001","DATA-CACHE-001","DATA-CRYPT-001","DATA-DELETE-001","DATA-MIGRATE-001","DATA-OFFLINE-001","DATA-STORE-001","MSEC-AUTH-001","MSEC-INPUT-001","MSEC-KEYCHAIN-001","MSEC-LOG-001","MSEC-NET-001","MSEC-SECRET-001","MSEC-THREAT-001","MSEC-WEB-001"],"alternatives":["Let Domain import convenient framework and SDK types.","Put capability protocols beside concrete adapters.","Share one unrestricted common module across all layers."],"check_ids":[],"consequences":["Domain and Application can be tested without platform, persistence, network, or vendor runtimes.","Replacing an adapter does not require changing the business contract it implements.","Boundary mapping adds deliberate code and prevents framework models from becoming domain models.","Public contracts must remain minimal because outward adapters and composition depend on them."],"context":"Long-lived product policy becomes expensive to test and evolve when Domain or Application code imports UI frameworks, orchestration libraries, persistence, networking, or vendor SDKs. A five-year standard needs dependency direction that keeps business meaning stable while platform and infrastructure adapters remain replaceable.","decision":"Keep Domain independent of UI, orchestration, persistence, networking, and vendor SDKs; let Application depend inward and own protocols for required outward capabilities; and require UI and Infrastructure adapters to implement those inward contracts while remaining outside the Domain and Application import graph.","decision_date":"2026-07-13","fixture_ids":[],"id":"ADR-0002","markdown_digest":"3d5ac9ec4436f94bd667f8249188bf739659f16cccce5057db608cebbe9d7f9b","migration":["Inventory outward imports in Domain and Application targets.","Move framework- or vendor-specific behavior to UI or Infrastructure adapters.","Define the required capability as an inward-owned protocol using inward-owned values.","Map external values at the boundary and migrate callers incrementally behind the protocol.","Remove the obsolete outward import only after all consumers use the inward contract."],"migration_ids":[],"owner_role_id":"Chief Architecture Owner","reference_artifact_ids":["standards/canon/adrs/ADR-0002-module-boundaries-and-dependency-direction.md","standards/canon/profiles/core.profile.json","standards/canon/rules/core/CORE-DEP-001.rule.json","standards/canon/rules/core/CORE-DEP-002.rule.json","standards/canon/rules/core/CORE-DEP-003.rule.json"],"schema_version":1,"status":"accepted","supersedes_adr_ids":[],"title":"Module Boundaries and Dependency Direction","verification_impact":["The final joined AI consistency review inspects dependency guidance, profiles, Skills, agents, examples, and scaffolds for outward imports or ownership that contradicts the three Core dependency Rules."]}
