{"accepted_at":"2026-07-12T23:23:34.000Z","affected_profile_ids":["boardy-vip","swiftui","uikit"],"affected_rule_ids":["BRD-VIP-001","UI-COPY-001","UI-HUMBLE-001","UI-HUMBLE-002","UI-HUMBLE-003","UI-HUMBLE-004","UI-ISOLATION-001","A11Y-CONTRAST-001","A11Y-FOCUS-001","A11Y-INPUT-001","A11Y-MOTION-001","A11Y-TYPE-001","A11Y-VOICE-001","I18N-FORMAT-001","I18N-LOCALIZE-001","I18N-PLURAL-001","I18N-RTL-001","SWUI-INTEROP-001","SWUI-NAV-001","SWUI-STATE-001","SWUI-VIEW-001"],"alternatives":["Forbid every conditional in a View","Allow each rendering adapter to format raw values and derive product meaning"],"check_ids":[],"consequences":["Presentation mapping is testable without rendering UI","UIKit and SwiftUI consume equivalent semantic state","Views may retain transient UX-local state without owning product decisions"],"context":"UIKit and SwiftUI need one testable presentation boundary that preserves humble Views without prohibiting legitimate rendering mechanics.","decision":"Use unidirectional VIP with Presenter-prepared display-ready state; Views render, forward typed intent, and own only UX-local or geometry-only values.","decision_date":"2026-07-13","fixture_ids":[],"id":"ADR-0005","markdown_digest":"7762ff8e032e7aacd7d8068021f62da8f784b7d58e8f71f8e3ca05e7b87174a8","migration":["Move formatting and product decisions to the Presenter or presentation mapper, introduce display-ready state, and retain only UX-local View state."],"migration_ids":["MIG-ADR-0005"],"owner_role_id":"iOS Profile Owner","reference_artifact_ids":["standards/brain/patterns/VIP.md"],"schema_version":1,"status":"accepted","supersedes_adr_ids":[],"title":"VIP presentation flow","verification_impact":["The final joined AI consistency review confirms the humble-View boundary and UIKit/SwiftUI semantic parity across Canon, Skills, and guidance."]}
