{"affected_profile_ids":["core"],"affected_rule_ids":["CAN-AUTH-001","CAN-AUTH-002","CAN-CONSIST-001","CAN-DERIVED-001","ADR-LIFECYCLE-001"],"alternatives":["Use prose precedence and let readers decide which document wins.","Duplicate normative statements in every guide and Skill.","Build a plugin-owned verifier and workflow state engine."],"check_ids":[],"consequences":["Every current obligation has a stable Rule ID and an applicable Profile.","Derived material must cite Canon and cannot silently weaken it.","Accepted ADR meaning is preserved; change creates an explicit superseding decision.","The final AI review must treat contradictions and orphan mappings as release-blocking findings."],"context":"Enterprise guidance becomes unsafe when prose, templates, Skills, agents, examples, and tooling can each define a different obligation. The Standards need durable intent, current machine-addressable Rules, decision history, scoped profiles, and operational guidance without creating several competing sources of truth.","decision":"Use the Constitution for durable intent, the Rule Registry as the sole machine-addressable source of current obligations, ADRs as immutable decision history, Profiles for applicability, and all guidance and agent surfaces as derived consumers that cannot invent Rules.","decision_date":"2026-07-13","fixture_ids":[],"id":"ADR-0001","markdown_digest":"fcc5e224a72d154ea820344fb1c81a20dd4e5cd8187416718519334a0ce37d2c","migration":["Identify enforceable claims in existing guidance and map them to Canon Rule IDs.","Replace duplicate normative definitions with concise references to those Rules.","Resolve contradictory guidance in the same semantic change that introduces the governing Rule or ADR.","Use superseding ADRs and replacement Rule IDs for future material changes; do not edit history into a different decision."],"migration_ids":[],"owner_role_id":"Canon Maintainer","reference_artifact_ids":["adrs/ADR-0001-standards-authority-and-evolution.md","profiles/core.profile.json","rules/core/ADR-LIFECYCLE-001.rule.json","rules/core/CAN-AUTH-001.rule.json","rules/core/CAN-AUTH-002.rule.json","rules/core/CAN-CONSIST-001.rule.json","rules/core/CAN-DERIVED-001.rule.json"],"schema_version":1,"status":"in_review","supersedes_adr_ids":[],"title":"Standards Authority and Evolution","verification_impact":["The final joined AI consistency review examines the complete Standards change for contradictory obligations, orphan mappings, invented derived Rules, and rewritten decision history."]}
