{"accepted_at":"2026-07-12T23:23:34.000Z","affected_profile_ids":["boardy-vip"],"affected_rule_ids":["BRD-BLOCKTASK-001","BRD-ID-001","BRD-LIFE-001","BRD-VIEWLESS-001"],"alternatives":["Include target naming such as IO in public BoardID values","Use one generic lifecycle rule for every Board type"],"check_ids":[],"consequences":["Board identity remains stable across target naming changes","Common and type-specific lifecycle obligations remain distinct","Re-activation and concurrent task routing have explicit safety boundaries"],"context":"Board IDs are cross-module contracts, while UI, viewless, flow, and block-task Boards have materially different lifecycle mechanics.","decision":"Use pub.mod.<Module>.<Board> public identities and apply common, viewless, and BlockTask lifecycle obligations through separate canonical Rules.","decision_date":"2026-07-13","fixture_ids":[],"id":"ADR-0004","markdown_digest":"590340e0ce7fa965b1dce082ea79a52e419e100faabf0be9fc931fc224eeea0f","migration":["Rename nonconforming IDs, classify each Board type, remove duplicate completion paths, and adopt the matching type-specific lifecycle contract."],"migration_ids":["MIG-ADR-0004"],"owner_role_id":"iOS Profile Owner","reference_artifact_ids":["standards/specs/MICROBOARD_NONUI.md"],"schema_version":1,"status":"accepted","supersedes_adr_ids":[],"title":"Board identity, ownership, and lifecycle","verification_impact":["The final joined AI consistency review confirms public IDs and common, viewless, and BlockTask lifecycle guidance agree across Canon and specs."]}
