{"accepted_at":"2026-07-12T23:23:34.000Z","affected_profile_ids":["uikit"],"affected_rule_ids":["UIKIT-DI-001","UIKIT-LIFE-001","UIKIT-RENDER-001"],"alternatives":["Map presentation values inside UIViewController","Construct business dependencies lazily from UIKit lifecycle callbacks"],"check_ids":[],"consequences":["UIKit lifecycle callbacks remain thin","Rendering shares presentation semantics with SwiftUI","Dependency lifetime stays visible in composition code"],"context":"UIViewController is both a framework lifecycle object and a rendering adapter, so its presentation and composition responsibilities need an explicit boundary.","decision":"Receive immutable display-ready state through a display port, forward typed events, mutate UI on MainActor, and construct business dependencies only in Builders or composition roots.","decision_date":"2026-07-13","fixture_ids":[],"id":"ADR-0008","markdown_digest":"187044789b8ed152afdd46f3513eae8ce6c94dc7877017f87749634a800258cc","migration":["Introduce a display port, move presentation mapping out of UIViewController, isolate UI mutation to MainActor, and move dependency construction to composition code."],"migration_ids":["MIG-ADR-0008"],"owner_role_id":"iOS Profile Owner","reference_artifact_ids":["standards/specs/MICROBOARD_UI.md"],"schema_version":1,"status":"accepted","supersedes_adr_ids":[],"title":"UIKit rendering adapter","verification_impact":["The final joined AI consistency review confirms UIKit rendering, lifecycle, isolation, and dependency guidance agrees with shared presentation Rules."]}
