{"accepted_at":"2026-07-12T23:23:34.000Z","affected_profile_ids":["core"],"affected_rule_ids":["TEST-BOUNDARY-001","TEST-ASYNC-001","TEST-CONTRACT-001","TEST-ARCH-001","TEST-SNAPSHOT-001","TEST-A11Y-001","TEST-SMOKE-001","TEST-PERF-001","TEST-EVIDENCE-001","TEST-NAME-001","PERF-BUDGET-001","PERF-ENERGY-001","PERF-FRAME-001","PERF-MEM-001","PERF-NET-001","PERF-REGRESS-001","PERF-START-001","RES-OFFLINE-001","RES-RETRY-001"],"alternatives":["Mandate Swift Testing for every test capability","Mandate XCTest for all new and existing tests","Require TDD and runtime gates for documentation and metadata","Accept AI assertions or generated green output as executable test evidence"],"check_ids":[],"consequences":["Framework choice follows required capability and repository compatibility","TDD effort follows executable behavior and regression risk","Asynchronous tests use deterministic bounded signals","Documentation consistency relies on the final joined AI review while executable-code claims remain command-backed","Project-owned tests use behavior-oriented camelCase naming"],"context":"iOS repositories need deterministic confidence across several test tiers without forcing one framework or fabricating runtime evidence for non-executable documentation.","decision":"Choose Swift Testing or XCTest by capability and repository compatibility; apply TDD only to executable behavior proportionally to risk; require deterministic bounded asynchronous tests, risk-based unit through performance signals, observed command-backed evidence for executable-code claims, final joined AI review for documentation consistency, and camelCase testScenarioExpectation naming.","decision_date":"2026-07-13","fixture_ids":[],"id":"ADR-0011","markdown_digest":"637bb33fb0ed370ff83a7d1728029aad675c1584902186e8bd8c75f93b3063fb","migration":["Adopt the framework boundary for new work, replace timing sleeps with controlled asynchronous dependencies, rename touched project-owned tests to testScenarioExpectation, remove tests that cannot falsify behavior, and route documentation consistency to final AI review."],"migration_ids":["MIG-ADR-0011"],"owner_role_id":"Testing Owner","reference_artifact_ids":["standards/enterprise/modern-testing.md"],"schema_version":1,"status":"accepted","supersedes_adr_ids":[],"title":"Testing and evidence boundary","verification_impact":["The final joined AI consistency review confirms the chapter, Rule records, framework boundary, executable-only TDD scope, evidence hierarchy, and camelCase naming remain aligned."]}
